Job Title,Company,Location,Education,Experience,Deadline
Project Coordinator (Host & Rohingya response),Nari Maitree,Ukhia,Masters degree in any discipline,4 to 6 year(s),30 Aug 2023
Project Officer (Host & Rohingya response),Nari Maitree,Ukhia,Bachelor degree in any discipline,2 to 3 year(s),30 Aug 2023
MEAL Officer,Nari Maitree,Ukhia,Masters degree in any discipline,3 to 5 year(s),30 Aug 2023
Visa Processing Counselor & Tour Package Operator,Shopno Tour,Gulshan,Bachelor degree in any disciplineBachelor`s degree,At least 2 year(s),30 Aug 2023
মার্কেটিং ও ভিসা এক্সিকিউটিভ,Shopno Tour,গুলশান,Bachelor of Commerce (B.Com) in Service MarketingBachelor degree in any disciplineএম কম/ এম বি এ/ ...,At least 2 year(s),30 Aug 2023
